{
  "$schema": "http://json-schema.org/draft-07/schema#",
  "title": "Routing Transition Schema",
  "type": "object",

  "properties": {
    "id": {
      "type": "string",
      "description": "Unique routing transition identifier"
    },

    "source": {
      "type": "string",
      "description": "The source node (world, ui, scene, service, error, state_machine, etc.)"
    },

    "target": {
      "type": ["string", "null"],
      "description": "The target node. Null allowed for terminal transitions."
    },

    "conditions": {
      "type": "array",
      "description": "List of conditions that must be satisfied for this transition",
      "items": { "type": "string" },
      "minItems": 1
    },

    "transitions": {
      "type": "array",
      "description": "List of transition actions to perform",
      "items": { "type": "string" },
      "minItems": 1
    },

    "profile": {
      "type": "string",
      "description": "Execution profile (ui, service, world, scene, error, etc.)"
    },

    "invariants": {
      "type": "array",
      "description": "Optional list of invariants that must hold for this transition",
      "items": { "type": "string" },
      "default": []
    }
  },

  "required": ["id", "source", "target", "conditions", "transitions", "profile"],

  "additionalProperties": false
}
