[
  {
    "id": "route_service_corridor_to_sort_lines",
    "source": "coord_service_corridor",
    "target": "coord_sort_lines",
    "conditions": ["navigation"],
    "transitions": ["enter_room"],
    "profile": "service",
    "invariants": []
  },
  {
    "id": "route_sort_lines_to_service_corridor",
    "source": "coord_sort_lines",
    "target": "coord_service_corridor",
    "conditions": ["navigation"],
    "transitions": ["exit_room"],
    "profile": "service",
    "invariants": []
  }
]
