[
  {
    "id": "route_decode_html_entities_to_hallway_03",
    "source": "decode_html_entities",
    "target": "hallway_03",
    "conditions": ["navigation"],
    "transitions": ["exit_room"],
    "profile": "standard",
    "invariants": []
  },
  {
    "id": "route_hallway_03_to_decode_html_entities",
    "source": "hallway_03",
    "target": "decode_html_entities",
    "conditions": ["navigation"],
    "transitions": ["enter_room"],
    "profile": "standard",
    "invariants": []
  }
]
