[
  {
    "id": "route_service_corridor_to_segment_clauses",
    "source": "coord_service_corridor",
    "target": "coord_segment_clauses",
    "conditions": ["navigation"],
    "transitions": ["enter_room"],
    "profile": "service",
    "invariants": []
  },
  {
    "id": "route_segment_clauses_to_service_corridor",
    "source": "coord_segment_clauses",
    "target": "coord_service_corridor",
    "conditions": ["navigation"],
    "transitions": ["exit_room"],
    "profile": "service",
    "invariants": []
  }
]
