[
  {
    "id": "route_floor_02_to_floor_01",
    "source": "floor_02",
    "target": "floor_01",
    "conditions": ["navigation"],
    "transitions": ["move_down"],
    "profile": "standard",
    "invariants": []
  },
  {
    "id": "route_floor_01_to_floor_02",
    "source": "floor_01",
    "target": "floor_02",
    "conditions": [],
    "transitions": ["move_up"],
    "profile": "standard",
    "invariants": []
  }
]
