[
  {
    "id": "route_http_delete_to_hallway_02",
    "source": "http_delete",
    "target": "hallway_02",
    "conditions": ["navigation"],
    "transitions": ["exit_room"],
    "profile": "standard",
    "invariants": []
  },
  {
    "id": "route_hallway_02_to_http_delete",
    "source": "hallway_02",
    "target": "http_delete",
    "conditions": ["navigation"],
    "transitions": ["enter_room"],
    "profile": "standard",
    "invariants": []
  }
]
