[
  {
    "id": "route_hotel_shell_to_hotel_root",
    "source": "hotel_shell",
    "target": "hotel_root",
    "conditions": ["navigation"],
    "transitions": ["enter_building"],
    "profile": "standard",
    "invariants": []
  },
  {
    "id": "route_hotel_root_to_hotel_shell",
    "source": "hotel_root",
    "target": "hotel_shell",
    "conditions": [],
    "transitions": [],
    "profile": "standard",
    "invariants": []
  }
]
