[
  {
    "id": "route_search_web_text_to_hallway_02",
    "source": "search_web_text",
    "target": "hallway_02",
    "conditions": ["navigation"],
    "transitions": ["exit_room"],
    "profile": "standard",
    "invariants": []
  },
  {
    "id": "route_hallway_02_to_search_web_text",
    "source": "hallway_02",
    "target": "search_web_text",
    "conditions": ["navigation"],
    "transitions": ["enter_room"],
    "profile": "standard",
    "invariants": []
  }
]
