[
  {
    "id": "route_world_root_to_field",
    "source": "world_root",
    "target": "field",
    "conditions": [],
    "transitions": [],
    "profile": "standard",
    "invariants": []
  },
  {
    "id": "route_field_to_world_root",
    "source": "field",
    "target": "world_root",
    "conditions": [],
    "transitions": [],
    "profile": "standard",
    "invariants": []
  }
]
