[
  {
    "id": "route_lobby_to_district_door",
    "source": "lobby",
    "target": "district_door",
    "conditions": ["navigation"],
    "transitions": ["approach_district_door"],
    "profile": "standard",
    "invariants": []
  },
  {
    "id": "route_district_door_to_lobby",
    "source": "district_door",
    "target": "lobby",
    "conditions": [],
    "transitions": [],
    "profile": "standard",
    "invariants": []
  }
]
