[
  {
    "id": "route_symbolic_differentiate_to_hallway_03",
    "source": "symbolic_differentiate",
    "target": "hallway_03",
    "conditions": ["navigation"],
    "transitions": ["exit_room"],
    "profile": "standard",
    "invariants": []
  },
  {
    "id": "route_hallway_03_to_symbolic_differentiate",
    "source": "hallway_03",
    "target": "symbolic_differentiate",
    "conditions": ["navigation"],
    "transitions": ["enter_room"],
    "profile": "standard",
    "invariants": []
  }
]
