[
  {
    "id": "route_service_corridor_to_clean_text",
    "source": "coord_service_corridor",
    "target": "coord_clean_text",
    "conditions": ["navigation"],
    "transitions": ["enter_room"],
    "profile": "service",
    "invariants": []
  },
  {
    "id": "route_clean_text_to_service_corridor",
    "source": "coord_clean_text",
    "target": "coord_service_corridor",
    "conditions": ["navigation"],
    "transitions": ["exit_room"],
    "profile": "service",
    "invariants": []
  }
]
