[
  {
    "id": "route_lobby_to_front_desk",
    "source": "lobby",
    "target": "front_desk",
    "conditions": ["navigation"],
    "transitions": ["approach_front_desk"],
    "profile": "standard",
    "invariants": []
  },
  {
    "id": "route_front_desk_to_lobby",
    "source": "front_desk",
    "target": "lobby",
    "conditions": [],
    "transitions": [],
    "profile": "standard",
    "invariants": []
  }
]
