[
  {
    "id": "route_postprocess_to_service_corridor",
    "source": "postprocess",
    "target": "service_corridor",
    "conditions": ["navigation"],
    "transitions": ["exit_room"],
    "profile": "standard",
    "invariants": []
  },
  {
    "id": "route_service_corridor_to_postprocess",
    "source": "service_corridor",
    "target": "postprocess",
    "conditions": ["navigation"],
    "transitions": ["enter_room"],
    "profile": "service",
    "invariants": []
  }
]
