[
  {
    "id": "route_llm_generate_text_to_hallway_01",
    "source": "llm_generate_text",
    "target": "hallway_01",
    "conditions": ["navigation"],
    "transitions": ["exit_room"],
    "profile": "standard",
    "invariants": []
  },
  {
    "id": "route_hallway_01_to_llm_generate_text",
    "source": "hallway_01",
    "target": "llm_generate_text",
    "conditions": ["navigation"],
    "transitions": ["enter_room"],
    "profile": "standard",
    "invariants": []
  }
]
